{
  "scope_id": "scope_free_chat_01",
  "mode": "free_chat",
  "library": "reference",
  "book_ids": [],
  "selectors": {
    "chapters": [],
    "page_ranges": [],
    "page_reference": "pdf",
    "tags": [],
    "tag_mode": "ANY"
  },
  "combine_logic": {
    "within_group": "OR",
    "between_groups": "AND"
  },
  "citations_required": false,
  "retrieval": {
    "enabled": false,
    "top_k": 8,
    "min_score": 0.2,
    "max_context_tokens": 2200,
    "rerank": false
  }
}
