{
  "scope_id": "scope_book_qa_chapters_01",
  "mode": "book_qa",
  "library": "reference",
  "book_ids": ["book_physics_11"],
  "selectors": {
    "chapters": ["ch_03", "ch_04"],
    "page_ranges": [],
    "page_reference": "book",
    "tags": [],
    "tag_mode": "ANY"
  },
  "combine_logic": {
    "within_group": "OR",
    "between_groups": "AND"
  },
  "citations_required": true,
  "retrieval": {
    "enabled": true,
    "top_k": 10,
    "min_score": 0.25,
    "max_context_tokens": 2400,
    "rerank": true
  }
}
