{
  "scope_id": "scope_book_qa_pdf_pages_01",
  "mode": "book_qa",
  "library": "reference",
  "book_ids": ["book_physics_11"],
  "selectors": {
    "chapters": [],
    "page_ranges": [
      {"from": 10, "to": 18},
      {"from": 42, "to": 48}
    ],
    "page_reference": "pdf",
    "tags": [],
    "tag_mode": "ANY"
  },
  "combine_logic": {
    "within_group": "OR",
    "between_groups": "AND"
  },
  "citations_required": true,
  "retrieval": {
    "enabled": true,
    "top_k": 6,
    "min_score": 0.15,
    "max_context_tokens": 1800,
    "rerank": false
  }
}
